{
  "schema_version": "lens_spec_v1",
  "lens_id": "lens_b0_identity_001",
  "lens_version": "1.0.0",
  "name": "B0 deterministic identity lens",
  "input_units_preserved": true,
  "coordinate_metadata_preserved": true,
  "random_seed": 20260825,
  "transforms": [
    {"order": 0, "type": "IDENTITY"}
  ]
}

